authors,title,author1,author2,organization,year,journal,keyFindings,metaDescription,onePageSummary,link,pillar,subpillar,solution,subcategory,file
Sala & Rechberger,SDG 14: Protecting half of the ocean?,"Sala, Enric ","Rechberger, Kristin ",National Geographic Society,2018,National Geographic Society,"SDG 14 aims to conserve and sustainably use oceans, but lacks a clear plan for achievement. Only 4% of the ocean is protected, and just 2% is fully safeguarded from extractive activities. The authors propose protecting half the ocean while sustainably managing the other half to achieve this goal. They emphasize the ocean's critical role in sustaining life on Earth, the damage caused by human activities, and the need for a comprehensive approach to ocean conservation and sustainable management to fulfill SDG 14.",SDG 14 seeks ocean conservation with only 4% protected now proposing to protect half the ocean while sustainably managing the other half to reach this goal (Sala & Rechberger).,,https://www.brookings.edu/wp-content/uploads/2018/03/FSTOS_chapter11.pdf,,,,,
Sala et al.,The economics of fishing the high seas,"Sala, Enric ","Mayorga, Juan ",National Geographic Society,2018,Science Advances,"This study examines the economic rationale for high-seas fishing, leveraging satellite data and machine learning to track fishing vessels and quantify fishing effort, costs, and benefits. Findings reveal that up to 54% of high-seas fishing would be unprofitable without government subsidies, particularly for deep-sea bottom trawling and fleets with low labor costs. The profitability of high-seas fishing varies by country and fishing type. These results highlight the need for reforms in subsidies and fishery management to ensure sustainable high-seas fishing practices.",High-seas fishing is mostly unprofitable without subsidies especially deep-sea trawling showing a need for subsidy reform and better fishery management (Sala et al).,,https://advances.sciencemag.org/content/4/6/eaat2504,,,,,
Sampaio et al.,Vertebrate population changes induced by hunting in Amazonian sustainable-use protected areas,"Sampaio, Ricardo","Morato, Ronaldo G. ",Instituto Chico Mendes de Conservação da Biodiversidade,2023,ScienceDirect,"This study investigates the impact of human activity on wildlife in sustainable-use reserves in the Brazilian Amazon. Using 720 camera traps, researchers analyzed factors influencing the abundance, richness, and reproductive rates of 29 mammal and bird species. The proximity to local communities, particularly within 5 km, was the main driver of wildlife declines, though some game species thrived near communities. Community size, urban proximity, and access to aquatic protein also affected species populations. Local protection enhanced species richness. These findings suggest that limiting habitat loss beyond a 5-km radius and implementing targeted game management strategies can improve conservation outcomes.",Proximity to communities drives wildlife declines in Amazon sustainable-use reserves though local protection helps with species richness  (Sampaio et al).,,https://doi.org/10.1016/j.biocon.2023.110206,,,,,
Sánchez-Bayo & Wyckhuys,Worldwide decline of the entomofauna: A review of its drivers,"Sánchez-Bayo, Francisco ","Wyckhuys, Kris A.G. ","School of Life & Environmental Sciences, Sydney Institute of Agriculture, The University of Sydney",2019,Biological Conservation,"Insect biodiversity is in global decline, with 40% of species at risk of extinction in the coming decades. A review of 73 studies highlights that Lepidoptera, Hymenoptera, and dung beetles are the most affected terrestrial species, while aquatic groups like Odonata and Ephemeroptera have already suffered major losses. Generalist species are replacing the declining specialists. Key drivers of decline include habitat loss due to agriculture and urbanization, pollution from pesticides and fertilizers, biological factors, and climate change. Urgent changes in agricultural practices, especially reduced pesticide use, and pollution cleanup are needed to reverse these trends and protect essential ecosystem services.",Insect biodiversity is falling with 40% at risk due to habitat loss pollution and climate change. Changes in farming and pollution cleanup are needed (Sanchez-Bayo & Wyckhuys).,,https://doi.org/10.1016/j.biocon.2019.01.020,,,,,
Sanderman et al.,"Soil carbon debt of 12,000 years of human land use","Sanderman, Jonathan ","Hengl, Tomislav ",Woods Hole Research Center,2017,PNAS,"Human agricultural activities have significantly altered soil organic carbon (SOC) levels, creating a large global carbon debt. Using machine learning models and global SOC data, this study estimates a 133 Pg C loss from the top 2 m of soil due to agriculture, with most losses occurring in the last 200 years. Both grazing and cropland contributed equally to SOC losses, with croplands showing higher percent loss but grazing lands contributing slightly more in total. SOC loss hotspots were identified in major cropping and semiarid grazing regions, suggesting specific areas for targeted SOC restoration to mitigate climate change.",Agriculture caused 133 Pg C soil carbon loss with cropland and grazing key contributors. Restoration should target cropping and semiarid grazing hotspots (Sanderman et al).,,https://doi.org/10.1073/pnas.1706103114,,,,,
Sandhu et al.,Natural farming through a wide-angle lens,"Sandhu, Harpinder","Sukhdev, Pavan ",,2023,Global Alliance for the Future of Food,"This study reveals that transitioning to APCNF (Agroecological Practices for Chemical-Free Natural Farming) leads to lower health risks, with farmers losing fewer working days to illness and incurring lower health costs due to reduced exposure to chemical pesticides. APCNF farms also exhibited higher household dietary diversity and stronger social capital, particularly among smaller farms. Women played a key role in enhancing social cohesion and knowledge sharing. Research highlights that APCNF provides better yields and crop diversity while addressing environmental and social goals. True Cost Accounting (TCA) shows better long-term returns compared to conventional farming, making it a viable climate-resilient model.","Agroecological farming cuts health risks, helps crop diversity, builds social ties, and improves yields with better returns than conventional farming (Sandhu et al).",,https://futureoffood.org/wp-content/uploads/2023/07/apcnf-tca-study_2023.pdf,,,,,
Sartore-Baldwin & McCullough,Examining Sport Fans and the Endangered Species Who Represent Their Affiliated Team Mascots,"Sartore-Baldwin, Melanie ","McCullough, Brian ","Department of Kinesiology, East Carolina University",2019,Society & Animals,"This study explored the relationship between sport fans and mascots representing endangered species. It found that highly identified fans were more inclined to learn about their endangered mascots. The research suggests that sport organizations are well-positioned to drive conservation efforts through partnerships and initiatives, leveraging fan engagement to raise awareness and promote environmental stewardship.",The study found fans of endangered species mascots are likelier to learn about them suggesting teams can promote conservation through fan engagement (Sartore-Baldwin & McCullough).,,https://brill.com/view/journals/soan/aop/article-10.1163-15685306-12341605.xml#.XL81bBt3yGg.twitter,,,,,
Saura et al.,Protected areas in the world’s ecoregions: How well connected are they?,"Saura, Santiago","Bastin, Lucy ",Joint Research Centre (JRC),2017,ScienceDirect,"This study introduces ProtConn, a global indicator for assessing the connectivity of protected areas (PAs). It quantifies the percentage of connected lands and analyzes movement between protected locations. Findings reveal that 9.3% of the world's land is covered by connected PAs, below the 14.7% global PA coverage, highlighting partial connectivity success. Only a third of ecoregions meet Aichi Targets for well-connected PAs. The study suggests that less strictly managed PAs can enhance connectivity and provides a tool to identify areas needing improvement. The ProtConn data is available in the Digital Observatory for Protected Areas.",This study shows ProtConn a global indicator with 9.3 percent of land protected and connected below 14.7 percent coverage highlighting connectivity gaps (Saura et al).,,https://doi.org/10.1016/j.ecolind.2016.12.047,,,,,
Sawin et al.,"A Global Energy Transition is well under way
Advancing the Global Renewable Energy Transition:
Highlights of the REN21 Renewables 2017 Global Status Report in Perspective","Sawin, Janet L. ","Seyboth, Kristin ",Sunna Research,2017,Renewables 2017 Global Status Report,"In 2016, renewable energy expanded globally, especially in developing economies. Declining costs for technologies like solar and wind, along with rising energy demand, contributed to record growth in power capacity, with 62% of new power capacity coming from renewables. Solar PV saw the largest increase. Renewable energy in heating, cooling, and transport grew more slowly, constrained by low fossil fuel prices and limited policy support. Biofuels dominated renewable transport energy, while electrification continued expanding. Renewable energy also employed 9.8 M people, with China leading. Policy initiatives, like the Paris Agreement, indirectly influenced renewable energy markets.",In 2016 renewable energy grew fast with record solar and wind gains while biofuels led transport. Low fossil prices and weak policies slowed heating (Sawin et al).,,http://www.ren21.net/gsr-2017/pages/highlights/highlights/,,,,,
Sayre et al.,An assessment of the representation of ecosystems in global protected areas using new maps of World Climate Regions and World Ecosystems,"Sayre, Roger ","Karagulle, Deniz ",U.S. Geological Survey,2020,Global Ecology and Conservation,"Accelerated climate action to limit warming to 1.5°C would reduce renewable energy costs, increase job creation, and improve energy access. It would also lower risks from extreme weather, boost agricultural productivity, and enhance energy independence. Limiting warming to 1.5°C would also reduce global GDP losses compared to higher temperature scenarios and help prevent irreversible environmental damage, including coral reef loss and rising sea levels. Achieving this goal requires collective global action to accelerate the transition to low-carbon technologies, particularly benefiting developing countries.",This study maps 431 ecosystems showing most are underprotected. Only 19 meet the 17 percent target with harsh areas like snow and ice best protected (Sayre et. al).,,https://doi.org/10.1016/j.gecco.2019.e00860,,,,,
M. Mckinnon (Ed.),Pursuing the 1.5C Limit: Benefits and Opportunities,"McKinnon, Mathew (Ed.)",,UNDP,2016,UNDP,"This report seeks to determine the benefits and opportunities related to a faster transition to low-carbon sustainable development. Global emissions have essentially not increased since 2013-2014 despite economic growth of greater than 3% per year, showing that decreasing emissions would not harm economic growth.",Fast climate action to limit warming to 1.5°C cuts energy costs creates jobs boosts access lowers weather risks and helps avoid severe environmental damage (M. Mckinnon).,,https://www.undp.org/sites/g/files/zskgke326/files/publications/Pursuing_1-5C-Limit.pdf,,,,,
Schauman et al.,Geometry of global protected lands,"Schauman, Santiago A. ","Peñuelas, Josep ","Grupo de Estudios Ambientales, IMASL-UNSL/CONICET",2023,Nature Sustainability,"This study highlights that global expansion of protected areas (PAs) has primarily added small, complex-shaped reserves. One-third of PAs are within 2 km of unprotected areas, while only 0.6% extend beyond 100 km. Developed nations have smaller, fragmented PAs, whereas less-affluent countries have larger, compact ones. Smaller, less-compact PAs are found in critically endangered biomes, posing long-term threats to biodiversity. The findings emphasize the urgent need to consider the spatial geometry of PAs to enhance conservation effectiveness and ensure global environmental sustainability.",Protected areas are mostly small and irregular with a third near unprotected lands. Richer nations have smaller fractured areas; poorer have larger ones (Schauman et al).,,https://www.nature.com/articles/s41893-023-01243-0,,,,,
Schmitz et al.,Trophic rewilding can expand natural climate solutions,"Schmitz, Oswald J. ","Sylvén, Magnus ","School of the Environment, Yale University",2023,"Nature Climate
Change","This study highlights the importance of incorporating wildlife conservation into natural climate solutions. While current strategies focus on carbon capture in plants, soils, and sediments, they often overlook the significant role animals play in regulating the carbon cycle. Scientific evidence shows that protecting and restoring wild animals and their ecological functions can enhance carbon storage, helping to prevent climate warming beyond 1.5°C. The research calls for a broader approach to climate solutions that includes the conservation of wild animals and their roles in ecosystems.",Protecting wild animals and their roles boosts carbon storage. Current solutions focus on plants and soils but overlook animals' impact (Schmitz et al).,,https://www.nature.com/articles/s41558-023-01631-6,,,,,
L. Montanarella (Ed.),Assessment Report on Land Degradation and Restoration,"Montanarella, Luca (Ed.)",,IPBES,2018,IPBES,"This assessment evaluates global land degradation and restoration trends across regions and land types, examining impacts on biodiversity, ecosystem services, and human well-being. It highlights current knowledge of restoration efforts and options by region, aiming to inform policies that address land degradation and desertification while promoting ecosystem restoration. The report enhances the understanding needed to develop effective strategies for mitigating land degradation and restoring degraded ecosystems.","This assessment reviews global land degradation, its impact on biodiversity, ecosystems, human well-being and explores restoration efforts to guide policies (L. Montanarella).",,https://www.ipbes.net/assessment-reports/ldr,,,,,
Scholtz & Twidwell,Last continuous grasslands on Earth,"Scholtz, Rheinhardt ","Twidwell, Dirac ","Department of Agronomy and Horticulture, University of Nebraska–Lincoln",2022,Conservation Science & Practice,"Grasslands are the most threatened and least protected biome, yet little research has identified remaining intact areas. This study, using WWF and IUCN data, highlights three key findings: only a few large intact grasslands remain; every continent has at least one; and these regions, despite human pressures, are critical for conservation. These grasslands provide essential ecosystem services, help mitigate climate change, support biodiversity, migration pathways, cultural heritage, and livelihoods. Preserving them is vital for global grassland conservation efforts under increasing anthropogenic pressures.","Grasslands are the most endangered and least protected biome. Few large intact areas remain, vital for biodiversity, climate, ecosystems, and livelihoods (Scholtz & Twidwell)",,https://doi.org/10.1111/csp2.626,,,,,
Schonbeck et al.,"Soil Health and Organic Farming: Understanding and Optimizing the Community
of Soil Life","Schonbeck, Mark","Jerkins, Diana",Organic Farming Research Foundation (OFRF),2019,Organic Farming Research Foundation,"Soil life underpins farming, sustaining crops and ecosystems. The soil food web transforms organic matter into nutrients, enhancing fertility. Organic farmers nurture soil health through compost, crop rotation, and minimal chemicals. Research confirms biodiverse soil boosts resilience, reduces risks, and supports long-term productivity, guiding sustainable farming practices.","Soil life sustains farming by cycling nutrients, enhancing fertility, and boosting resilience. Organic methods protect microbes for long-term productivity Schonbeck et al).",,https://ofrf.org/wp-content/uploads/2019/09/Soil_Biology_Guide.pdf,,,,,
Schonbeck et al.,"Soil Health and Organic Farming: Nutrient Management for Crops, Soil, and the Environment",Schonbeck et al.,,Organic Farming Research Foundation (OFRF),2017,Organic Farming Research Foundation,"Organic farming centers on maintaining healthy, living soil as the basis for plant, animal, and human health. Instead of synthetic fertilizers, organic growers rely on compost, manure, legumes, and natural minerals, promoting soil life to release nutrients gradually. This enhances resilience and reduces pollution and greenhouse gas emissions. However, organic systems face nutrient timing challenges, nitrogen limitations, phosphorus buildup, and yield tradeoffs. Despite progress from USDA research, many organic farmers still prioritize improved nutrient management tools and knowledge. This report aims to guide farmers in adopting effective, science-based practices for better productivity and environmental outcomes.","Organic farming uses compost and natural inputs to build soil health but faces nitrogen limits, phosphorus buildup, timing issues, and yield tradeoffs (Schonbeck et al).",,https://ofrf.org/wp-content/uploads/2019/09/Heller_Nutrients_V2-F_WebRes2.pdf,,,,,
Schonbeck et al.,"Soil Health and Organic Farming: Organic Practices for Climate Mitigation, Adaptation, and Carbon Sequestration",Schonbeck et al.,,Organic Farming Research Foundation (OFRF),2018,Organic Farming Research Foundation,"Climate change intensifies droughts, storms, heat waves, and pest pressures, threatening agriculture and food security. It disrupts crop cycles, erodes soil, and reduces organic matter. Key greenhouse gases—carbon dioxide, methane, and nitrous oxide—have sharply increased due to industrial activities. Healthy soils improve resilience and sequester carbon, helping mitigate climate change.","Climate change disrupts farming via heat, storms, pests, and erosion; healthy soils boost resilience and cut emissions through carbon storage (Schonbeck et al).",,https://ofrf.org/soil-health-and-organic-farming-reports/,,,,,
Schonbeck et al.,Soil Health and Organic Farming: Weed Management,Schonbeck et al.,,Organic Farming Research Foundation (OFRF),2017,Organic Farming Research Foundation,"Weed management is a major challenge in organic farming due to the exclusion of herbicides. Farmers rely on tillage, which can harm soil health by degrading structure, reducing organic matter, and increasing erosion. While reduced-till methods using cover crops align with soil health goals, they often struggle with weed control and yields.",Organic weed control via tillage risks soil health; reduced-till with cover crops aids soil but struggles with weed suppression and yield stability (Schonbeck et al).,,https://ofrf.org/wp-content/uploads/2019/09/Heller_Weed_Report_V17-F_WebRes-150.pdf,,,,,
Schreckenberg et al.,Ecosystem Services and Poverty Alleviation,"Schreckenberg, Kate","Mace, Georgina ",,2018,Routledge,"This book reviews the connection between ecosystem services and poverty alleviation, focusing on findings from the Ecosystem Services for Poverty Alleviation (ESPA) program. It synthesizes key research from over 120 projects in 50 countries, offering insights into sustainable ecosystem management and its role in achieving poverty reduction and sustainable growth. The book discusses the challenges posed by changing environmental conditions, explores innovative governance and conservation approaches, and highlights the relevance of ESPA’s work for achieving the Sustainable Development Goals. It serves as a valuable resource for researchers and policymakers in ecology and sustainable development.","This book links ecosystem services to poverty reduction, sharing insights from ESPA's work. It explores sustainable management, growth, and global goals (Schreckenberg et al).",,https://www.routledge.com/Ecosystem-Services-and-Poverty-Alleviation-OPEN-ACCESS-Trade-offs-and/Schreckenberg-Mace-Poudyal/p/book/9781138580848,,,,,
Schultheiss et al.,"Abundance, biomass, and distribution of ants on Earth","Schultheiss, Patrick","Nooten, Sabine S. ","School of Biological Sciences, The University of Hong Kong",2022,PNAS,"This study addresses the lack of data on the global abundance and distribution of insects, particularly ants. Using data from 489 studies, researchers estimate the total global ant population at nearly 20 × 10¹⁵ individuals, with a biomass of around 12 megatons of dry carbon, exceeding that of wild birds and mammals combined. Ant populations are most concentrated in tropical and subtropical regions, with the highest density in forests and arid regions. These findings emphasize ants' crucial ecological role and highlight gaps in knowledge about their distribution and abundance, offering a baseline for studying environmental impacts on insects.","The global ant population is nearly 20 × 10¹⁵ individuals, with a biomass of 12 megatons, highlighting ants' key ecological role and distribution gaps (Schultheiss et al).",,https://doi.org/10.1073/pnas.2201550119,,,,,
Schuster et al.,"Vertebrate biodiversity on indigenous-managed lands in Australia, Brazil, and Canada equals that in protected areas","Schuster, Richard ","Germain, Ryan R. ","Department of Forest and Conservation Sciences, University of British Columbia",2019,ScienceDirect,"This study explores how partnerships between Indigenous communities and government agencies in Australia, Brazil, and Canada could help address global biodiversity shortfalls. Indigenous-managed lands were found to be slightly richer in vertebrate species than existing protected areas in all three countries and supported more threatened species in Brazil and Canada. The findings suggest that Indigenous-managed lands host similar biodiversity levels to conventional protected areas. Strengthening Indigenous land management practices can potentially help nations meet international biodiversity conservation targets and address the ongoing biodiversity crisis driven by habitat loss and land conversion.","Indigenous lands in Australia, Brazil, and Canada have similar or higher vertebrate biodiversity than protected areas, helping global conservation efforts (Schuster et al).",,https://www.sciencedirect.com/science/article/pii/S1462901119301042?via%3Dihub#!,,,,,
J. Schwartz,Soil as Carbon Storehouse: New Weapon in Climate Fight?,"Schwartz, Judith D. ",,,2014,Yale Environment 360,"This study highlights the critical role of soil carbon in combating climate change and maintaining ecosystem health. Historically, land conversion and habitat loss have released significant amounts of soil carbon into the atmosphere, worsening climate impacts. Scientists are now exploring ways to restore soil carbon through regenerative practices, such as agroforestry, deep-rooted grasses, and Holistic Planned Grazing. These methods can boost carbon storage, improve soil productivity, and enhance resilience to climate stressors. Researchers emphasize that soil carbon sequestration must be part of global strategies for climate mitigation, food security, and ecosystem restoration.","Restoring soil carbon through regenerative farming, agroforestry and grazing is key to fighting climate change, boosting yields, and ensuring food security (J. Schwartz).",,http://e360.yale.edu/features/soil_as_carbon_storehouse_new_weapon_in_climate_fight,,,,,
Scott et al.,Impact on short-lived climate forcers increases projected warming due to deforestation,"Scott, C. E. ","Monks, S. A. ","School of Earth and Environment,, University of Leeds",2018,Nature Communications,"Deforestation's climate impact is influenced by biogeochemical and biogeophysical factors, including CO2 exchange, surface albedo, and biogenic volatile organic compounds (BVOCs) emissions. These BVOCs affect short-lived climate forcers (SLCFs) like aerosols, ozone, and methane. A scenario of complete deforestation would result in a net positive radiative forcing (RF) of 0.12 W/m², contributing to 0.8 K global warming over 100 years, with SLCFs responsible for 8% of the warming. However, under the RCP8.5 scenario, no net RF from SLCFs is projected due to nonlinearities in the aerosol effect.","Deforestation affects climate through carbon dioxide, reflectivity,and compounds impacting aerosols, ozone and methane possibly causing 0.8 degree warming (Scott et al).",,https://www.nature.com/articles/s41467-017-02412-4,,,,,
Searchinger et al.,Assessing the efficiency of changes in land use for mitigating climate change,"Searchinger, Timothy D. ","Wirsenius, Stefan ","Woodrow Wilson School of Public and International Affairs, Princeton University",2018,Nature,"This study addresses the critical role of land-use changes in climate policy, as agricultural expansion and production contribute 20-25% of global greenhouse gas emissions. Meeting future food demands, expected to rise by 50% by 2050, while maintaining or increasing carbon storage requires more efficient land use. Carbon benefits index quantifies the efficiency of land in storing carbon and reducing emissions based on various outputs and agricultural practices. The index reveals that reforesting pastures, biofuel production, and dietary changes can have a greater impact on reducing emissions than previously recognized. Biodiversity and ecosystem values require separate analysis.",Land-use changes in farming contribute 20-25% of greenhouse emissions. A carbon benefits index can help assess land's efficiency for food or carbon storage (Searchinger et al).,,https://www.nature.com/articles/s41586-018-0757-z,,,,,
