authors,title,author1,author2,organization,year,journal,keyFindings,metaDescription,onePageSummary,link,pillar,subpillar,solution,subcategory,file
Limb et al.,Potential of carbon markets to accelerate green infrastructure based water quality trading,"Limb, Braden J. ","Quinn, Jason C. ",Colorado State University,2024,Communications Earth & Environment,"Green infrastructure solutions, permitted under the U.S. Clean Water Act, can improve water quality while reducing reliance on energy-intensive gray infrastructure. Compared to traditional methods, green infrastructure in the U.S. could save $15.6B, 21.2 TWh of electricity, and 29.8M tonnes of CO2 emissions annually, while sequestering 4.2M tonnes of CO2. Additionally, it could generate $679M per year in carbon credits, incentivizing water quality trading and accelerating environmental benefits over a 40-year horizon.","Green infrastructure saves $15.6B, cuts 29.8M tonnes CO2, and generates $679M in carbon credits yearly, boosting water quality and reducing energy use (Limb et al).",,https://www.nature.com/articles/s43247-024-01359-x,,,,,
Liotta et al.,Environmental and welfare gains via urban transport policy portfolios across 120 cities,"Liotta, Charlotte 
","Viguié, Vincent ",Mercator Research Institute on Global Commons and Climate Change,2023,Nature Sustainability,"City-level policies are crucial for reducing transport greenhouse gas emissions, but their global impact, cost, and feasibility vary. Using a model calibrated on 120 cities, this study evaluates four emission-reducing policies, revealing a potential 31% reduction in transport emissions over 15 years. However, policy outcomes differ widely by city, influenced by factors like income, population growth, spatial organization, and public transport. Welfare-positive policies can achieve a 22% reduction. The study underscores the need for context-specific strategies to maximize emissions reduction while improving economic welfare.","City-level policies could cut transport emissions by 31% in 15 years, but impacts vary by city. Tailored, positive strategies reduce emissions while enhancing well-being (Liotta et al).",,https://www.nature.com/articles/s41893-023-01138-0,,,,,
Littleton et al.,Dynamic modelling shows substantial contribution of ecosystem restoration to climate change mitigation,"Littleton, Emma W.","Dooley, Kate ",University of Exeter,2021,Environmental Research Letters,"Limiting global warming to 1.5°C requires drastic emissions reductions and carbon removal, often relying on biomass energy with carbon capture, which risks biodiversity and food security. Ecosystem-based approaches, including reforestation, agroforestry, and silvopasture, could sequester 93 Gt C by 2100, reducing global temperature rise by 0.12°C. These land management strategies offer additional benefits, such as ecosystem restoration and biodiversity protection, making them more publicly supported in climate policy pathways.","Ecosystem methods like reforestation and agroforestry could sequester 93 Gt C by 2100, low warming by 0.12°C and support biodiversity and resilience (Littleton et al).",,https://iopscience.iop.org/article/10.1088/1748-9326/ac3c6c,,,,,
Liu et al.,Global patterns of daily CO2 emissions reductions in the first year of COVID-19,"Liu, Zhu ","Deng, Zhu ",Tsinghua University,2022,Nature Geoscience,"In 2020, global CO2 emissions dropped by 6.3% (2,232 MtCO2) compared to 2019, largely due to reduced economic activity during COVID-19 lockdowns. The transportation sector saw the largest decrease. Emissions gradually recovered towards 2019 levels by late April, though later lockdowns caused smaller reductions. The 2020 emissions drop highlights the scale of reductions needed to limit global warming to 1.5°C, underscoring the urgency of advancing the energy transition.","Global CO2 emissions fell 6.3% in 2020 with COVID-19 lockdowns, mainly from reduced transport. This highlights the need to meet 1.5°C climate targets (Liu et al).",,https://www.nature.com/articles/s41561-022-00965-8,,,,,
Liu et al.,Genome-Wide Evolutionary Analysis of Natural History and Adaptation in the World’s Tigers,"Liu, Yue-Chen","Sun, Xin ",Peking-Tsinghua Center for Life Sciences,2018,Science Direct,"The tiger (Panthera tigris), with fewer than 4,000 remaining, sparks debate over its subspecies classification, hindering conservation efforts. Whole-genome sequencing of 32 specimens identifies six monophyletic subspecies, including the Malayan tiger, with low intersubspecies gene flow. These genomic insights help define conservation units, aiding strategic global tiger recovery efforts. Adaptive traits, such as the body-size gene ADH7 in Sumatran tigers, highlight subspecies-specific adaptations and underscore the importance of genomic analysis for conservation management.","Genome sequencing identifies six tiger subspecies with low gene flow, aiding conservation. Adaptive traits like ADH7 in Sumatrans guide recovery efforts (Liu et al).",,https://doi.org/10.1016/j.cub.2018.09.019,,,,,
Liu et al.,Tree species richness increases ecosystem carbon storage in subtropical forests,"Liu, Xiaojuan","Trogisch, Stefan ",The Chinese Academy of Sciences,2018,Current Biology,"Forest ecosystems play a key role in the global carbon cycle, but uncertainty exists about how species richness affects carbon fluxes and stocks. This study, based on measurements from subtropical forests in southeast China, shows that species-rich forests have higher carbon stocks and fluxes than low-diversity forests, with older stands also storing more carbon. For each additional tree species, total carbon stock increases by 6.4%. These findings suggest afforestation policies should shift from monocultures to multi-species plantations to enhance carbon sequestration and mitigate climate change.",Forests store more carbon than monocultures with species increasing carbon stock by 6.4%. Policies favor multi-species plantations to fight climate change (Liu et al).,,https://doi.org/10.1098/rspb.2018.1240,,,,,
T. Lovejoy,Extinction tsunami can be avoided,"Lovejoy, Thomas ",,George Mason University,2017,PNAS,"The recent study on vertebrate population declines can be traced back to early 20th-century efforts documenting extinctions, such as the Passenger Pigeon. Once abundant, its extinction illustrates the unpredictability of population collapses. Today, with tools like e-bird and increased awareness, extinction rates and environmental degradation are closely monitored. The Global 2000 Report in 1980 projected future extinctions to raise awareness and prevent them from becoming a reality, reflecting the increasing number of species listed as endangered, as seen in the IUCN Red List and other sources.","Early studies are tied to extinction efforts, such as the Passenger Pigeon loss. Modern tools like e-bird now track population trends to prevent declines (T. Lovejoy).",,https://doi.org/10.1073/pnas.1711074114,,,,,
A. Lovins,"US nuclear power: Status, prospects, and climate implications","Lovins, Amory B. 
",,Stanford University,2022,Science Direct,"Nuclear power is being heavily promoted and subsidized, yet is facing a global commercial decline due to poor economics. In the U.S., nuclear energy lacks an operational, business, or climate-driven justification for expansion. This summary highlights the growing subsidies alongside the industry's economic challenges, questioning its viability for future energy solutions.","Despite promotion and subsidies, nuclear power faces a decline due to poor economics (A. Lovins)",,https://doi.org/10.1016/j.tej.2022.107122,,,,,
Lowder et al.,"Number, Size, and Distribution of Farms, Smallholder Farms, and Family Farms Worldwide","Lowder, Sarah K","Skoet, Jakob ",Food and Agriculture Organization of the United Nations,2016,World Development,"Agricultural census data reveals over 570M farms globally, with most being small and family-operated. Small farms (under 2 ha) manage 12% of agricultural land, while family farms operate 75%. From 1960 to 2000, farm sizes decreased in low-income countries but increased in high-income regions. Accurate, up-to-date data is essential for shaping agricultural strategies, with a need for better standardized agricultural census data globally to track trends in farm size and farmland distribution.","Census data shows 570M small global farms are family-run. Small farms manage 12%, family farms 75%. Accurate, standardized data is key to tracking trends (Lowder et al).",,https://doi.org/10.1016/j.worlddev.2015.10.041,,,,,
Luby et al.,When and where to protect forests,"Luby, Ian H. ","Miller, Steve J. ",University of Minnesota,2022,Nature,"Ongoing deforestation threatens biodiversity, prompting the need to prioritize conservation efforts. Using dynamic optimization, this study identifies an optimal sequence for conserving plant species across 458 global forested ecoregions over 50 years. The strategy initially targets regions where deforestation has the largest impact on species loss and conservation costs are low. Over time, efforts expand to more regions, focusing on both protecting primary forests and reforestation. Key regions for conservation gains include Melanesia, South and Southeast Asia, Anatolia, and Central and northern South America. Targeted investments can yield substantial biodiversity benefits.","Optimization identifies regions for plant conservation starting with high-impact, low-cost areas. Key regions include Melanesia, SE Asia, and the Americas (Luby et al).",,https://www.nature.com/articles/s41586-022-05096-z,,,,,
M. Velasquez-Manoff,Can dirt save the Earth?,"Velasquez-Manoff, Moises ",,,2018,New York Times,"In 1998 a couple bought a ranch in California, initially seeking space for creative work. After removing grazing cows to restore the land, they observed deteriorating ecosystem health. Upon advice from a rangeland ecologist, they reintroduced cows, restoring the grasslands and learning about the potential of carbon farming. This method uses land management practices, like composting and grazing, to enhance carbon sequestration in soil. Carbon farming has gained attention as a cost-effective, natural way to mitigate climate change by reducing atmospheric carbon, improving soil health, and benefiting agriculture. While challenges remain, this approach is promising for climate solutions.","Reintroducing cows and carbon farming restored a ranch, improved soil health and sequestered carbon, and lowered cost as a natural climate change solution (M. Velasquez-Manoff).",,https://www.nytimes.com/2018/04/18/magazine/dirt-save-earth-carbon-farming-climate-change.html,,,,,
MacDonald et al.,Future cost-competitive electricity systems and their impact on US CO2 emissions,"MacDonald, Alexander E.","Clack, Christopher T. M. ","Earth System Research Laboratory, NOAA",2016,Nature Climate Change,"Carbon dioxide emissions from electricity generation, a key driver of climate change, can be reduced by up to 80% in the US using wind and solar power. This study shows that, with anticipated future costs and no need for energy storage, emissions can be significantly cut without raising electricity costs. Optimizing wind and solar energy use across large-scale weather patterns through a national electricity grid, enabled by high-voltage direct-current transmission, allows these reductions using current technology. This shift away from a regionally divided system is crucial for decarbonizing the US electricity sector.",Wind and solar cuts US electricity CO2 emissions by 80% with no extra cost by optimizing large-scale weather patterns using a national high-voltage grid (MacDonald et al).,,https://www.nature.com/articles/nclimate2921,,,,,
Mackey et al.,Understanding the importance of primary tropical forest protection as a mitigation strategy,"Mackey, Brendan","Keith, Heather ",Griffith University,2020,Mitigation and Adaptation Strategies for Global Change,"To limit global warming, prioritizing primary tropical forest protection is crucial. These forests store 141-159 Pg C, around 49-53% of all tropical forest carbon, with living biomass alone making up 91-103% of the carbon budget needed to keep warming below 1.5°C. Tropical forests sequester 0.47-1.3 Pg C annually, 8-13% of global anthropogenic CO2 emissions. Strategies include halting deforestation, restoring forests, and improving sustainable management. Primary forests store 35% more carbon than logged ones, with recovery times of 40 to 100+ years. Proforestation and reforestation are essential to mitigate emissions and enhance carbon sequestration.",Primary tropical forests store 49-53% of carbon and sequester 8-13% of CO2 emissions. Protecting and restoring them is key to limiting warming below 1.5°C (Mackey et al).,,https://link.springer.com/article/10.1007/s11027-019-09891-4,,,,,
Mackey et al.,Assessing the Cumulative Impacts of Forest Management on Forest Age Structure Development and Woodland Caribou Habitat in Boreal Landscapes: A Case Study from Two Canadian Provinces,"Mackey, Brendan","Campbell, Carly ",Griffith University,2023,land,"The Canadian boreal forest, managed primarily for wood production, has seen significant logging impacts, especially in Ontario and Quebec. Since 1976, 14M hectares have been logged, leaving 21M hectares of older forests, crucial for the threatened woodland caribou. Habitat fragmentation is severe, with 53.5% of caribou ranges disturbed. Three populations are at very high risk, 16 at high risk, and two at low risk due to habitat loss. Sustainable management, with a focus on protecting and restoring older forests, is essential to reduce risks to caribou populations in these regions.",Logging in Canada's boreal forests threatens caribou. Over 53% of habitats are disturbed; urgent forest protection and restoration are needed for survival (Mackey et al).,,https://doi.org/10.3390/land13010006,,,,,
Macreadie et al.,Blue carbon as a natural climate solution,"Macreadie, Peter I.
","Costa, Micheli D. P. ","School of Life and Environmental Sciences, Deakin University",2021,"Nature Reviews Earth &
Environment","Blue carbon ecosystems (BCEs) like mangroves, seagrasses, and tidal marshes store over 30,000 Tg of carbon and offer co-benefits like coastal protection. BCE conservation could prevent 304 Tg CO2e emissions annually, while restoring 17.5–41.6M hectares could sequester an additional 841 Tg CO2e per year by 2030, representing ~3% of global emissions. Mangrove restoration offers the greatest carbon benefits. Although BCE loss will continue, prioritizing protection and restoration, particularly through coastal planning and recognizing co-benefits, presents a scalable and cost-effective natural climate solution, despite barriers to widespread adoption.",Blue carbon ecosystems provide coastal protection and fisheries enhancement. Prioritizing mangrove restoration offers scalable climate and coastal benefits (Macreadie et al).,,https://www.nature.com/articles/s43017-021-00224-1,,,,,
Maezumi et al.,"The legacy of 4,500 years of polyculture agroforesty in the eastern Amazon","Maezumi, S. Yoshi ","Alves, Daiana ","College of Humanities, University of Exeter",2018,Nature Plants,"Pre-Columbian land use in the Amazon has left a lasting impact on modern forest composition, particularly in the hyperdominance of edible plants. Over the past 4,500 years, indigenous practices like polyculture agroforestry, limited forest clearing, and low-severity fire management promoted food security and enriched edible plant species. These systems, combined with the development of Amazonian dark earths, supported maize cultivation and sustained growing populations. This long-term anthropogenic influence highlights the enduring legacy of ancient land management, offering insights for modern conservation and ecosystem management in the Amazon.","Pre-Columbian agroforestry enriched edible plants for 4,500 years. Ancient land use shaped modern forests, offering insight for conservation and management (Maezumi et al).",,https://www.nature.com/articles/s41477-018-0205-y,,,,,
"Mahecha et al.
",Biodiversity and Climate Extremes: Known Interactions and Research Gaps,"Mahecha, M.D.
","Bastos, A. ","Institute for Earth System Science and Remote Sensing, Leipzig University",2024,Earth's Future,"Climate extremes are increasing, and biodiversity can buffer ecosystems from their impacts. However, intensified land exploitation threatens this capacity. Reduced biodiversity destabilizes ecosystem functioning, potentially worsening climate extremes. A comprehensive approach that integrates ecological and hydrometeorological perspectives is needed to fully understand these feedbacks. This requires shifting research priorities to focus on the bidirectional links between biodiversity loss and climate extremes.",Rising climate extremes and biodiversity loss destabilize ecosystems. An approach linking ecology and climate is key to understanding these feedbacks (Mahecha et al).,,https://doi.org/10.1029/2023EF003963,,,,,
Mahowald et al.,Are the impacts of land use on warming underestimated in climate policy?,"Mahowald, Natalie M.","Ward, Daniel S.",,2017,Environmental Research Letters,"While carbon dioxide emissions from energy use are the primary focus of climate change mitigation, land use and land cover change (LULCC) also play a significant role. This study shows that LULCC emissions cause more warming per unit of carbon dioxide due to methane and nitrous oxide co-emissions. Current IPCC projections underestimate future LULCC impacts, as real deforestation rates are higher. Even if non-LULCC emissions ceased in 2015, 1.5°C warming is still likely by 2100. Reducing LULCC emissions is crucial to meeting Paris Agreement targets, and future models should incorporate more realistic deforestation scenarios.",Land use and land cover change drive warming due to methane and nitrous oxide emissions. Reducing LULCC emissions is crucial to meet climate targets (Mahowald et al).,,http://iopscience.iop.org/article/10.1088/1748-9326/aa836d/meta,,,,,
RFI,Majority of world's food producers risk being cooked by climate change,RFI,,,2022,RFI,"Climate change is intensifying heatwaves and extreme weather globally, threatening food crop production. 20 countries, including India, are at extreme risk from heat stress, with the number rising to 64 nations by 2045, impacting 71% of global food production. Major crops like rice and cocoa are particularly vulnerable. India's agricultural sector, vital to global food supply, faces dire risks due to outdoor labor reliance. Africa and Southeast Asia will also see severe impacts, with Africa housing 9 of the top 10 high-risk countries. Even major economies like the US and China will experience significant regional risks.","Climate change causes heatwaves, weakening global crops. 20 nations face acute heat stress, rising to 64 by 2045, affecting 71% of global food production (RFI).",,https://www.rfi.fr/en/international/20220909-majority-of-world-s-food-producers-risk-being-cooked-by-climate-change,,,,,
Malhi et al.,Role of large wild animals in climate change mitigation and adaptation,"Malhi, Yadvinder","Lander, Tonya ","School of Geography and the Environment, University of Oxford",2022,Current Biology,"This study explores the role of large wild animals in addressing climate change and biodiversity loss. Large animals can positively impact climate change mitigation through altering fire regimes, influencing albedo, and increasing vegetation and soil carbon stocks. They also enhance ecosystem adaptation by promoting complex food webs, habitat heterogeneity, plant dispersal, and microclimate modification. However, interactions between wildlife conservation and climate goals may present trade-offs, depending on the biome. Understanding these mechanisms helps identify where synergies or conflicts between conservation and climate action may arise.","Large animals aid climate mitigation via fire regimes, albedo shifts, and carbon storage, through complex webs and habitat diversity (Malhi et al).",,https://www.cell.com/current-biology/fulltext/S0960-9822(22)00101-4?_returnURL=https%3A%2F%2Flinkinghub.elsevier.com%2Fretrieve%2Fpii%2FS0960982222001014%3Fshowall%3Dtrue,,,,,
Markandya & González-Eguino,Integrated Assessment for Identifying Climate Finance Needs for Loss and Damage: A Critical Review,"Markandya, Anil ","González-Eguino, Mikel  ",Basque Centre for Climate Change,2018,Home Loss and Damage from Climate Change,"This chapter examines the use of Integrated Assessment Models (IAMs) to estimate Loss and Damage (L&D) from climate change and the financial needs to address it. The analysis shows that significant residual damages remain even with optimal adaptation, varying by region, climate scenario, discount rate, and model assumptions. Given uncertainties and suboptimal adaptation, actual L&D could be substantial. Financial constraints may further exacerbate L&D, as current resources likely result in adaptation below optimal levels.","Integrated Assessment Models show significant damage even with adaptation. Regional, financial, and model ambiguity suggest vast future Loss and Damage (Markandya & González-Eguino).",,https://link.springer.com/chapter/10.1007/978-3-319-72026-5_14,,,,,
Market & Markets,"Indoor Farming Technology Market by Growing System (Hydroponics, Aeroponics, Aquaponics, Soil-based, Hybrid), Facility Type, Component, Crop Type (Fruits & Vegetables, Herbs & Microgreens, Flowers & Ornamentals) and Region - Global Forecast to 2028",Market & Markets,,,2017,Market Research Report,"The global indoor farming technology market, valued at $18.6B in 2022, is projected to reach $32.3B by 2028, with a 9.7% CAGR. The growth is driven by increasing demand for fresh, nutrient-rich food, space and water efficiency, and reduced dependence on external weather. Indoor farming uses controlled environment agriculture to optimize temperature, humidity, light, and nutrients, enhancing crop yields and addressing traditional farming challenges.","Indoor farming will grow to $32.3B by 2028. Driven by demand for fresh food, it optimizes yields with controlled environments and minimal resources (Market & Markets).",,https://www.marketsandmarkets.com/Market-Reports/indoor-farming-technology-market-40175861.html,,,,,
Martin et al.,Conservation opportunities across the world's anthromes,Martin et al.,,Cornell University,2014,Diversity and Distributions,"Biologists increasingly acknowledge the role of humans in ecosystems, highlighting the need for biodiversity conservation in human-altered environments. Traditional biogeographical frameworks, like biomes, often overlook human land use, limiting their relevance for conservation planning. ""Anthromes"" map global ecological patterns shaped by human activity. This paper examines how current conservation efforts are distributed across these anthromes to address human impact on ecosystems.","Conservation must include human-altered ecosystems. ""Anthromes"" map human-shaped ecological patterns, revealing gaps that ignore human impacts (Martin et al).",,https://doi.org/10.1111/ddi.12220,,,,,
Marvin et al.,Natural climate solutions provide robust carbon mitigation capacity under future climate change scenarios,"Marvin, David C.
","Sleeter, Benjamin M. ","Salo Sciences, Inc.",2023,Scientific Reports,"Natural Climate Solutions (NCS) can significantly reduce greenhouse gas emissions and increase carbon storage. Using California as a reference, this study evaluates NCS potential under four climate scenarios starting in 2020. By mid-century, NCS flips California from a carbon source to a sink in two scenarios, with forest and conservation land management providing 85% of reductions and agriculture 15%. While severe climate impacts later in the century could turn ecosystems into carbon sources, NCS can reduce emissions by 41-54% by 2100. Implementing NCS costs $752-777M annually, offering long-term carbon protection despite climate-driven disturbances.","Natural Climate Solutions in California can cut emissions by 41-54%, turning the state into a carbon sink. Forest management drives 85% of reductions (Marvin et al).",,https://www.nature.com/articles/s41598-023-43118-6,,,,,
Matthews et al.,Temporary nature-based carbon removal can lower peak warming in a well-below 2 °C scenario,"Matthews, H. Damon ","Zickfeld, Kirsten ",Concordia University,2022,Communications Earth & Environment,"Achieving the Paris Agreement's climate goals requires net-zero CO2 emissions by mid-century. Nature-based climate solutions (NCS) can aid in carbon sequestration but risk losing stored carbon through disturbances like wildfires or deforestation. This study shows that temporary carbon storage can reduce peak temperature rise if combined with aggressive fossil fuel emission reductions. However, non-CO2 effects, such as surface albedo changes from reforestation, could offset nearly half of the sequestration benefits. NCS offer climate benefits, but only as a complement to substantial reductions in fossil fuel emissions, not as an alternative.",Nature-based climate solutions lower peak temperatures if combined with net-zero fossil fuel emissions but can be offset by non-CO2 albedo changes (Matthews et al).,,https://www.nature.com/articles/s43247-022-00391-z,,,,,
