authors,title,author1,author2,organization,year,journal,keyFindings,metaDescription,onePageSummary,link,pillar,subpillar,solution,subcategory,file
Estrada et al.,"Global importance of Indigenous Peoples, their lands, and knowledge systems for saving the world’s primates from extinction","Estrada, Alejandro ","Garber, Paul A.","Institute of Biology, National Autonomous University of Mexico,",2022,Science Advances,"Primates, comprising 521 species across 91 countries, mainly in the Neotropic, Afrotropic, and Indo-Malayan realms, are crucial for ecosystem health. However, 68% face extinction risks from habitat conversion for agriculture and resource extraction. Indigenous Peoples' lands, covering 30% of primate habitats and inhabited by 71% of primate species, offer significant protection. Enhancing protections for these lands, languages, and cultures is essential for primate conservation.","Vital to ecosystems, primates face 68% extinction risk due to habitat loss. Indigenous lands protect 71% of species, requiring enhanced conservation efforts (Estrada et al).",,https://www.science.org/doi/10.1126/sciadv.abn2927,,,,,
Evans et al.,Carbon farming via assisted natural regeneration as a cost-effective mechanism for restoring biodiversity in agricultural landscapes,"Evans, Megan C.","Carwardine, Josie ",The Australian National University,2015,Environmental Science & Policy,"Carbon farming in agricultural landscapes offsets emissions and boosts biodiversity via ecosystem restoration. Reforestation using native species, called environmental plantings, aids carbon offset and biodiversity. Assisted natural regeneration in Queensland's 30.6M hectares of deforested land could be more cost-efficient. It’s economically viable at $65.8 per ton CO2e, 60% lower than environmental plantings ($108.8 per ton CO2e). This method sequesters 1.6-2.2 times more carbon. Viability spans 2.3% to 34% with carbon prices from $5 to $50. This low-cost technique highlights the dual benefits of carbon sequestration and biodiversity conservation.","Carbon farming offsets emissions and boosts biodiversity through ecosystem restoration, with native species reforestation aiding carbon offset and conservation (Evans et al).",,https://doi.org/10.1016/j.envsci.2015.02.003,,,,,
Everard et al.,The role of ecosystems in mitigation and management of Covid-19 and other zoonoses,"Everard, Mark","Johnston, Paul A. ",University of the West of England,2020,Environmental Science & Policy,"There is rising concern about the zoonotic origins of many global pandemics. Zoonotic origins highlight the vital connection between human, animal, and environmental health. ​Human activities degrade ecosystems, weakening natural disease regulation and increasing zoonotic disease risks. Ecosystem protection boosts human security by preserving crucial services. The DPSIR framework analyzes the role of ecosystem services in zoonotic disease emergence, human disease regulation, and outbreak treatment. The COVID-19 crisis showcases the potential for rapid, large-scale systemic change, essential for addressing climate change and biodiversity crises, emphasizing the need for global action and donor nation participation.","Zoonotic diseases highlight human-animal-environment health links. Ecosystem protection reduces disease risks, stressing global action to prevent pandemics (Everard et al).",,https://doi.org/10.1016/j.envsci.2020.05.017,,,,,
Falk et al.,Exponential Climate Action Roadmap,"Falk, Johan","Gaffney, Owen ","Stockholm
Resilience Centre and Future Earth",2018,Global Climate Action Summit,"This abstract outlines a 2030 climate action roadmap emphasizing the need for rapid and extensive transformation to mitigate extreme climate change impacts.The strategy advocates for transitioning from incremental to exponential actions, generating momentum, and maintaining realistic perspectives on emission reductions and practical implementation.","A 2030 climate roadmap emphasizes a need for rapid, transformative actions to mitigate extreme impacts, and a shift from incremental to exponential efforts (Falk et al).",,https://exponentialroadmap.org/wp-content/uploads/2018/09/Exponential-Climate-Action-Roadmap-September-2018.pdf,,,,,
Fanning & Hickel,Compensation for atmospheric appropriation,"Fanning, Andrew L.
","Hickel, Jason ",Doughnut Economics Action Lab,2023,Nature Sustainability,"Research on carbon inequalities reveals that some nations are exceeding their fair share of the carbon budget, thus bearing disproportionate responsibility for climate breakdown. Compensation or reparations are suggested for impacted countries. ​By evaluating carbon prices from IPCC scenarios and cumulative emissions from 1960, it is found that even with a net-zero goal by 2050, the global North overshoots its share by threefold, demanding compensation of $192T to the global South. This amounts to $940 per capita annually. Additionally, comparisons across different starting years and carbon budgets were quantified.","Research shows the global North exceeds its carbon budget, suggesting $192T in reparations to the global South for climate responsibility, or $940 per capita annually (Fanning & Hickel).",,https://www.nature.com/articles/s41893-023-01130-8,,,,,
FAO,State of food and agriculture (PDF),FAO,,,2014,FAO,"More than 500M family farms manage most of the world's agricultural land, producing the majority of its food. ​Ensuring global food security, environmental protection, and poverty eradication hinges on public policies that support productivity and sustainability. Innovation is key, enabling farmers to improve practices by combining traditional methods with new scientific knowledge. A collaboration involving the public sector, private companies, civil society, and farmer organizations is essential to foster effective systems. These systems must consider the diversity of family farms and the complexity of their challenges, including gender and intergenerational aspects, and adapt policies to specific farming contexts considering globalization, resource pressures, and climate change.","Global food security requires policies supporting sustainable farming, combining innovation with tradition, and adapting to diverse challenges in a collaborative effort (FAO).",,http://www.fao.org/3/a-i4036e.pdf,,,,,
FAO,Global Forest Resources Assessment (PDF),FAO,,,2015,FAO,"The Global Forest Resources Assessment 2015 (FRA 2015) comprises three main publications. The first provides extensive data on global forest resources and changes over 25 years. The second, ""How are the world's forests changing?"", offers summary analyses. The third is a special issue of Forest Ecology and Management, with detailed analyses. Country reports and detailed data are accessible via the Forest Land Use Data Explorer (FLUDE) for further analysis. Key reference documents include country reports, a reporting guide, and a terms and definitions document, offering comprehensive methodological and definitional clarity.",The Global Forest Resources Assessment provides extensive data on 25 years of global forest changes and detailed analyses accessible via the Forest Land Use Data Explorer (FAO).,,http://www.fao.org/3/a-i4808e.pdf,,,,,
Fargione et al.,Natural climate solutions for the United States,"Fargione, Joseph E.","Bassett, Steven ",The Nature Conservancy,2018,Science Advances,"Limiting climate warming to below 2°C necessitates increased mitigation, including land stewardship in the U.S. We assessed the potential of 21 natural climate solutions (NCS) interventions, finding a maximum mitigation potential of 1.2 Pg CO2e annually, or 21% of U.S. net emissions. At current carbon market rates, 299 Tg CO2e per year is achievable. Additionally, NCS benefits include enhanced air and water filtration, flood control, soil health, habitat, and climate resilience.","Limiting warming below 2°C requires U.S. land stewardship, with natural climate solutions offering 21% of net emissions reduction and multiple ecosystem benefits (Fargione et al).",,https://www.science.org/doi/10.1126/sciadv.aat1869,,,,,
A. Farnoosh,"Power Generation from Coal, Oil, Gas, and Biofuels","Farnoosh, Arash",,Paris School of International Affairs,2022,The Palgrave Handbook of International Energy Economics,"This chapter explores the economics of generating electricity from coal, oil, natural gas, and biofuel, detailing technologies, CAPEX, OPEX, dispatchability, flexibility, location, and service life. ​It includes formulas and calculations for optimizing technology choices and presents a comparative analysis of these power generation methods, drawing key conclusions on their economic viability and performance.","This chapter analyzes the economics of coal, oil, gas, and biofuel electricity, comparing CAPEX, OPEX, flexibility, and performance, to optimize technology choices (A. Farnoosh).",,https://doi.org/10.1007/978-3-030-86884-0_6,,,,,
Fastre et al.,Integrated spatial planning for biodiversity conservation and food production,"Fastre, Constance","van Zeist, Willem-Jan ",Zoological Society of London,2021,One Earth,"Ambitious area-based conservation targets for post-2020 necessitate addressing increased farmland demand, a key driver of biodiversity loss. This study analyzed three global conservation strategies under 2030's business-as-usual farmland demand, finding integrated spatial planning achieves conservation goals at 25%-40% of food production opportunity costs or enhances biodiversity benefits by 400%-600%. Achieving targets requires managing over 60% of land for conservation, including 8%-11% restoration, and negotiating land governance strategies","Post-2020 conservation addresses increased farmland demandtargets require integrated spatial planning, reducing food production costs by or boosting biodiversity by covering over 60% of land (Fastre et al).",,https://www.sciencedirect.com/science/article/pii/S259033222100600X,,,,,
Feng et al.,Doubling of annual forest carbon loss over the tropics during the early twenty-first century,"Feng, Yu","Searchinger, Timothy D. ",Southern University of Science and Technology,2022,Nature Sustainability,"​Recent high-resolution satellite data reveal a doubling of gross tropical forest carbon loss from 0.97 ± 0.16 PgC yr⁻¹ (2001–2005) to 1.99 ± 0.13 PgC yr⁻¹ (2015–2019). This increase contradicts land-use models showing stable or declining emissions. Agricultural activities, both large-scale commodity and small-scale, drive 82% of this loss, especially in Africa and Southeast Asia. About 70% of deforested lands converted to agriculture by 2019 remained agricultural in 2020. This rapid carbon loss indicates current deforestation strategies are failing, highlighting the need for improved monitoring post-Glasgow pledges.","High-resolution data shows tropical forest carbon loss doubled in 8 years, driven by agriculture, signaling failing deforestation strategies and a need for better monitoring (Feng et al).",,https://www.nature.com/articles/s41893-022-00854-3,,,,,
M. Ferguson,2018 Survey of Young People and Social Change,"Ferguson, Meredith",,,2018,Medium,"Gen Z places a high priority on consumer activism, leveraging their influence to hold brands accountable, especially amidst political disenchantment. They rapidly expose corporate failures on social media, as seen in reactions to cases like Starbucks' racial profiling incident. Gen Z seeks leadership from brands in social change, technology, and entertainment. 67% of young people have stopped purchasing a product (40%) or would consider doing so (27%) if the company stood for something or behaved in a way that didn’t align with their values. ​","Gen Z prioritizes consumer activism, using social media to hold brands accountable. 67% stop purchases if a brand's values misalign with theirs (M. Ferguson).",,https://medium.com/dosomethingstrategic/money-talks-and-drives-social-change-ad38cab7fc33,,,,,
Fewster et al.,Imminent loss of climate space for permafrost peatlands in Europe and Western Siberia,"Fewster, Richard E.
","Morris, Paul J. ",University of Leeds,2022,Nature Climate Change,"Human-induced climate warming could thaw extensive northern permafrost peatlands by 2100, but spatiotemporal thaw dynamics remain uncertain. Under moderate-to-high warming scenarios (SSP2-4.5, SSP3-7.0, SSP5-8.5), peatlands storing 37.0–39.5 Gt carbon will surpass a climatic tipping point. By 2040, all of Fennoscandia will be unsuitable for permafrost. Strong emission reductions (SSP1-2.6) could preserve peatlands with 13.9 Gt carbon in northern Western Siberia by the 2090s. Socio-economic policies will dictate permafrost peatland thaw rates and extents.","Climate warming threatens to thaw northern permafrost peatlands by 2100, releasing up to 39.5 Gt carbon. Emission reductions could preserve some peatlands by 2090 (Fewster et al).",,https://www.nature.com/articles/s41558-022-01296-7,,,,,
Field et al.,"Climate Change 2014: Impacts, Adaptation, and Vulnerability","Field, Christopher B.","Barros, Vicente R. ",,2014,IPCC,"Climate change's multifaceted impacts emphasize direct and indirect effects on diverse areas and ecosystems. Highlighted are the interconnectedness of Earth’s systems, focusing on risk management and the integration of climate change with other issues. New chapters address expanded topics like human settlements, security, and livelihoods, reflecting growing literature. ​It is vital to manage climate risks by evaluating hazards, vulnerabilities, and exposures, and linking adaptation, mitigation, and sustainable development. This approach clarifies solutions and leverages investments for resilient communities, economies, and ecosystems worldwide.","Climate change impacts ecosystems, human settlements, and security, requiring integrated risk management, adaptation, and sustainable development for global resilience (Field et al).",,https://www.ipcc.ch/report/ar5/wg2/,,,,,
Fischer et al.,"Community forest governance and synergies among carbon, biodiversity and livelihoods","Fischer, Harry W. 
","Chhatre, Ashwini ",Swedish University of Agricultural Sciences,2024,Nature Climate Change,"Forest landscape restoration is vital for carbon sequestration, biodiversity conservation, and improving livelihoods for indigenous and local communities. Analyzing 314 forest commons across 15 tropical countries, we explored the relationships between carbon in woody biomass, tree species richness, and forest livelihoods. Notably, five distinct clusters with various co-benefits and trade-offs were identified. Formal community management and participatory rule-making predict positive outcomes. ​Globally, these findings emphasize the critical role of local governance in achieving restoration goals and call for a nuanced understanding of multiple interconnected forest benefits for effective interventions.","Forest restoration boosts carbon sequestration, biodiversity, and livelihoods, with local governance crucial for success, revealing diverse benefits and trade-offs (Fischer et al).",,https://www.nature.com/articles/s41558-023-01863-6,,,,,
Fletcher & Büscher,Conservation basic income: A non-market mechanism to support convivial conservation,"Fletcher, Robert","Büscher, Bram",Wageningen University,2020,Biological Conservation,"The article proposes a Conservation Basic Income (CBI) as a new strategy for funding biodiversity conservation. This approach responds to growing discussions on cash transfer programs (CTPs) and universal basic income (UBI), which often overlook environmental issues. It also addresses the shortcomings of market-based instruments (MBIs) like PES and REDD+, which have failed to halt biodiversity loss and alleviate poverty. ​The article advocates for integrating and transcending existing mechanisms to develop CBI, promoting a paradigm shift towards convivial conservation that emphasizes social justice and equity.","The article proposes Conservation Basic Income (CBI) to fund biodiversity conservation, addressing market failures and promoting social justice in conservation efforts (Fletcher & Büscher).",,https://doi.org/10.1016/j.biocon.2020.108520,,,,,
FOA,State of World Fisheries and Aquaculture,FOA,,,2016,FOA,"Experts highlight the significant potential of oceans and inland waters to bolster food security and nutrition for a projected global population of 9.7B by 2050. Fisheries and aquaculture are crucial for food, nutrition, income, and livelihood globally, with per capita fish supply hitting a record 20 kg in 2014. Aquaculture now accounts for half of the fish consumed. More than 85% of global seafood exports originate in developing nations, yet less than 40% of those nations are collecting adequate data on their catch. ​","Oceans and inland waters are crucial for food security, with aquaculture now accounts for half of fish consumed, yet data collection in developing nations is lacking (FOA).",,http://www.fao.org/3/a-i5555e.pdf,,,,,
Fontoura et al.,Protecting connectivity promotes successful biodiversity and fisheries conservation,"Fontoura, Luisa
","D’Agata, Stephanie ",Macquarie University,2022,Science,"The global decline of coral reefs necessitates strategies that balance biodiversity conservation and fisheries benefits. Investigating the spatial ecology of ecosystem services, this study combined larval dispersal networks and human pressure estimates. The findings indicate that reefs receiving larvae from well-connected dispersal corridors have high fish species richness, with larval ""sinks"" showing double the fish biomass of ""sources"" and greater resilience when protected. Despite these benefits, up to 70% of key dispersal corridors, sinks, and source reefs lack protection, highlighting the urgent need to safeguard these well-connected reef networks.","Coral reefs in larval ""sinks"" double fish biomass and resilience, yet 70% lack protection, urgently requiring conservation to balance biodiversity and fisheries benefits (Fontoura et al).",,https://www.science.org/doi/10.1126/science.abg4351,,,,,
Frank et al.,Changes in agriculture could cut sector non-CO2 greenhouse gas emissions by up to 50 percent,"Frank, Stefan","Havlík, Petr ",,2018,Science Daily,The agricultural sector leads global non-CO2 greenhouse gas emissions. Research indicates that adopting sustainable agricultural practices and shifting diets away from meat and dairy could halve these emissions by 2050 compared to unmitigated scenarios.,Agriculture is the top non-CO2 emitter; sustainable practices and reduced meat/dairy diets could halve emissions by 2050 compared to unmitigated scenarios (Frank et al).,,https://www.sciencedaily.com/releases/2018/12/181217120025.htm,,,,,
Frankenberg et al.,Airborne methane remote measurements reveal heavy-tail flux distribution in Four Corners region,"Frankenberg, Christian","Thorpe, Andrew K.",California Institute of Technology,2016,PNAS,"Methane (CH4), a potent greenhouse gas influencing climate and air quality, shows large enhancements in the Four Corners region. In April 2015, an airborne campaign employing next-generation spectrometers detected over 250 methane plumes from sources like gas facilities and pipeline leaks, with emissions ranging from ∼2 kg/h to ∼5,000 kg/h. ​The top 10% of emitters contributed 49 to 66% of the total flux (0.23–0.39 Tg/y). This method efficiently identifies major sources for mitigation and scales to space-based applications, evidenced by two repaired pipeline leaks detected during the campaign.
","Methane levels spiked in the Four Corners region, with the top 10% of emitters contributing 49-66% of emissions, highlighting key sources for targeted mitigation (Frankenberg et al).",,https://www.pnas.org/content/113/35/9734,,,,,
Frechette et al.,Toward a Global Baseline of Carbon Storage in Collective Lands,"Frechette, Alain","Reytar, Katie ",RRI,2016,Rights and Resources,"Indigenous and local communities oversee approximately 25% of the aboveground carbon in tropical forests, totaling 54,546 MtC. Furthermore, 10% of this forest carbon resides on collective lands lacking formal recognition, putting 22,322 MtC at heightened risk of deforestation and other threats. ​Effective management and legal acknowledgment of these lands are critical for carbon storage and climate mitigation.","Indigenous communities manage 25% of tropical forest carbon, but 10% needs formal recognition, risking 22,322 MtC. Legal protection is vital for climate mitigation (Frechette et al).",,http://rightsandresources.org/wp-content/uploads/2016/10/Toward-a-Global-Baseline-of-Carbon-Storage-in-Collective-Lands-November-2016-RRI-WHRC-WRI-report.pdf,,,,,
Friedman-Heiman & Miller,The impact of refrigeration on food losses and associated greenhouse gas emissions throughout the supply chain,"Friedman-Heiman, Aaron 
","Miller, Shelie A.",,2024,Environmental Research Letters,"One-third of global food production is wasted, impacting 800M hungry individuals and contributing 8% of anthropogenic GHG emissions. This study introduces a tool to assess the impact of cold chain access on food loss and GHG emissions. Poor cold chains may cause 620 Mmt of food loss and 1.8 GtCO2-eq annually. Optimized cold chains could notably reduce fruit and vegetable loss and GHG emissions in specified regions. Localized supply chains outperform optimized cold chains, saving over 250 Mmt of roots and tubers globally and reducing meat-related GHGs by 300 Mmt CO2-eq, emphasizing the need for balanced investments.","One-third of global food is wasted, causing hunger and 8% of GHG emissions. Optimized cold chains can reduce food loss and emissions, but localized supply chains are more effective (Friedman-Heiman & Miller).",,https://iopscience.iop.org/article/10.1088/1748-9326/ad4c7b,,,,,
Fuller et al.,Assessing the impact of China's timber industry on Congo Basin land use change,"Fuller, Trevon L.","Narins, Thomas P. ",University of California,2018,Area,"The extraction of natural resources in the Congo Basin has been driven by consumer demand in China and the USA. ​From 2001 to 2015, Chinese timber imports from the Congo Basin, primarily Cameroon and the Republic of Congo, doubled, correlating with significant tree-cover loss. Additionally, US demand for Chinese-made furniture has promoted increased timber harvesting in the region. These findings highlight the intricate environmental and economic factors associated with deforestation, emphasizing the need for sustainable consumer choices to protect this biodiversity","Consumer demand from China and the USA drives Congo Basin deforestation, with Chinese timber imports doubling from 2001 to 2015, stressing the need for sustainable choices (Fuller et al).",,https://rgs-ibg.onlinelibrary.wiley.com/doi/abs/10.1111/area.12469,,,,,
Furey & Tilman,Plant biodiversity and the regeneration of soil fertility,"Furey, George N.","Tilman, David",University of Minnesota,2021,PNAS,"The ecological mechanisms underlying soil fertility creation and restoration, particularly the role of plant diversity, are not well understood. In a 23-year unfertilized plant biodiversity experiment, plots with 16 perennial grassland species showed 30-90% higher increases in essential soil nutrients compared to monocultures. ​High plant functional diversity, involving grasses, legumes, and forbs, significantly enhanced nutrient pools, suggesting that varying species are crucial for soil fertility regeneration. Consequently, plant diversity is a promising strategy for restoring soil fertility and carbon stores through enhanced plant productivity and trade-offs in nutrient content and root mass.","A 23-year study shows plant diversity significantly boosts soil nutrients, with diverse grassland species enhancing fertility by 30-90% compared to monocultures (Furey & Tilman).",,https://www.pnas.org/doi/10.1073/pnas.2111321118,,,,,
Gaines et al.,Improved fisheries management could offset many negative effects of climate change,"Gaines, Steven D.","Costello, Christopher ","University of California, Santa Barbara",2018,Science Advances,"The world’s oceans provide crucial food and livelihoods, but climate change-induced shifts in species' ranges and productivity threaten these benefits. Effective fishery management reforms are essential to offset negative impacts. Poor current stock status and maladaptive responses could further reduce yields and profits. However, by addressing current inefficiencies, adapting to productivity changes, and establishing transboundary institutions, fisheries could achieve higher future profits and yields than today.","Climate change threatens ocean food supplies. Effective fishery management, addressing stock inefficiencies, and adapting to changes could improve future yields and profits (Gaines et al).",,http://advances.sciencemag.org/content/4/8/eaao1378/tab-figures-data,,,,,
Garnett et al.,A spatial overview of the global importance of Indigenous lands for conservation,"Garnett, Stephen T. ","Burgess, Neil D. ",Charles Darwin University,2018,Nature Sustainability,"Understanding the extent and significance of lands under Indigenous Peoples' traditional rights is vital for global conservation and climate goals. Using geospatial data, it was found that Indigenous Peoples hold rights over ~38M km² in 87 countries, covering over a quarter of the world's land and intersecting 40% of terrestrial protected areas and intact landscapes. ​Recognizing Indigenous land rights and fostering partnerships with conservationists and governments are crucial for conserving ecologically significant areas and achieving conservation objectives.","Geospatial data reveals Indigenous rights cover 38M km², intersecting 40% of protected areas. Recognizing these rights is key to global conservation goals (Garnett et al).",,https://www.nature.com/articles/s41893-018-0100-6,,,,,
