authors,title,author1,author2,organization,year,journal,keyFindings,metaDescription,onePageSummary,link,pillar,subpillar,solution,subcategory,file
Blanca et al.,Global carbon dioxide removal rates from forest landscape restoration activities,"Bernal, Blanca","Murray, Lara T. ",Winrock International,2018,Carbon Balance & Management,"Across all tropical trees, reforestation yields an average of 22 tCO2/yr per hectare carbon dioxide removal for the first 20 years. Across all temperate trees, reforestation yields an average of 14 tCO2/yr. Across all boreal trees, reforestation yields an average of 7.5 tCO2/yr. Mangrove restoration yields 23 tCO2/yr for the first 20 years, and 10.5 tCO2/yr for subsequent years. 1 hectare of restored mangroves if undisturbed could sequester as much as 880 tCO2.","Global analysis of forest landscape restoration to provide carbon dioxide removal rates for tropical, temperate, boreal, and mangrove trees (Bernal et al).",,https://cbmjournal.biomedcentral.com/articles/10.1186/s13021-018-0110-8,Nature Conservation,Ecosystem Restoration,Reforestation,,
M. Acreman,Environmental flows–basics for novices,"Acreman, Mike",,Centre for Ecology & Hydrology (UK),2016,WIREs Water,"Defines ‘environmental flows’ as the hydrological regime necessary to sustain freshwater and estuarine ecosystems, widely used in conservation planning. The paper sites an array of different approaches, providing a planning framework based on five critical questions facing water managers in assessing environmental flow needs for river ecosystems — (1) setting objectives for river ecosystems, (2) examining pressures that hinder these objectives, (3) determining the required level of detail for planning, (4) implementing conservation measures, and (5) understanding how climate change and land use change could affect the success of watershed management over the long term.","A sustainable hydrological regime that includes setting objectives for river ecosystems and examining what hinders these objectives (M. Acreman).
",,https://doi.org/10.1002/wat2.1160,Biodiversity Loss,,,,
Adame et al.,"Avoided emissions and conservation of scrub mangroves: potential for a Blue Carbon project in the Gulf of California, Mexico","Adame, M. F. ","Najera-Hillman, E. ",Griffith University (AU),2018,Biology Letters,"Short-statured 'scrub' mangroves (under 2 m in height) found in arid areas are often overlooked as a Blue Carbon solution. They are not considered to be 'trees' under the REDD+ carbon credit framework, but their deforestation emissions are significant. A new project in the Gulf of California (Mexico) aims to protect approximately 16,000 ha of mangroves, avoiding 2.8 MtCO2 emissions over 100 years, valued at $426,000 annually. The funds generated from carbon credits will support community-based mangrove management, including surveillance, invasive species eradication, storm rehabilitation, and educational outreach.
","A Gulf of California Blue Carbon project protects 16,058 ha of mangroves, avoiding 2.8M Mt CO2 emissions over 100 years, funding community-based mangrove management (Adame et al).",,https://doi.org/10.1098/rsbl.2018.0400,Nature Conservation,Land Conservation,Conserved Lands,Land Habitats,
Aguirre-Gutiérrez et al.,Valuing the functionality of tropical ecosystems beyond carbon,"Aguirre-Gutiérrez, Jesus","Stevens, Nicola",Oxford University (UK),2023,Science & Society,"Tree planting on tropical grasslands (afforestation) is attractive to carbon credit developers due to favourable climatic and topographic conditions that promote rapid plant growth. But tropical ecosystems offer billions of dollars in other ecosystem services -- carbon storage, water provisioning, grazing land, nature-based tourism, and biodiversity conservation. Increasing woody biomass on intact savanna ecosystems generally represents a state of degradation. Carbon-focused tree planting exacerbates biodiversity loss, particularly of species adapted to open environments. For example, in the Brazilian Cerrado (savanna) a 40% increase in woody cover resulted in a ~30% reduction in the diversity of plants and ants. It also can deplete groundwater, reducing streamflow between 40-80%.","Tree planting in grasslands can offset emissions but risks harming ecosystems. Restoring balance among services, biodiversity, and carbon is crucial (Aguirre-Gutiérrez et al).




",,https://doi.org/10.1016/j.tree.2023.08.012,Nature Conservation,Ecosystem Restoration,Grassland Restoration,,
Allan et al.,The minimum land area requiring conservation attention to safeguard biodiversity,"Allan, James R. ","Possingham, Hugh P.",University of Amsterdam (NL),2022,Science,"Ambitious conservation efforts must cover 64M km² (44% of terrestrial land) to protect key biodiversity, ecologically intact areas, and species representation. Over 1.8B people depend on these lands, necessitating equitable and sustainable management. Immediate action is needed as 1.3M km² risk conversion by 2030. Differences in land-use scenarios present opportunities to mitigate habitat loss and should be integral to the Post-2020 Global Biodiversity Framework","Ambitious conservation is needed to protect 64M km² (44%) of terrestrial land, impacting 1.8 B people. Immediate action is required to prevent 1.3M km² conversion by 2030 (Allan et al).",,https://www.science.org/doi/10.1126/science.abl9127,Nature Conservation,Land Conservation,,,
Altieri et al.,Agroecology and the design of climate change-resilient farming systems,"Altieri, Miguel A. ","Nicholls, Clara I.",University of California-Berkeley,2015,Agronomy for Sustainable Development,"Climate change is expected to severely affect agricultural production through increased temperatures and altered precipitation, reducing crop yields. Crop yields are threatened by temperature and water availability, compounded by shifts in pest, pathogen, and weed dynamics. ​Adaptation through strategic agroecological measures, such as polycultures, agroforestry, crop-livestock systems, organic soil management, and water conservation, can bolster resilience. Traditional farming systems offer valuable strategies, and farms with increased biodiversity have shown greater resilience to extreme climatic events. Enhanced biodiversity and sustainable practices can significantly bolster agricultural resilience to climate extremes.",Temperature rise and altered precipitation threaten crop yields and ecosystem dynamics; biodiversity-driven agroecological strategies can enhance resilience (Altieri et al).,,https://link.springer.com/article/10.1007/s13593-015-0285-2,Regenerative Agriculture,Regenerative Croplands,,,
Arment et al.,Wildlife Connectivity Fundamentals for Conservation Action,"Ament, Rob","Tabor, Gary",Center for Large Landscape Conservation,2014,Center for Large Landscape Conservation,"Wildlife species in the U.S. are becoming increasingly isolated in habitat patches due to human landscapes, habitat loss, degradation, and fragmentation. Current protected areas cannot fully conserve biodiversity, resulting in shrinking distributions for many species. Climate change exacerbates isolation issues, making fragmented landscapes less resilient to disturbances and more prone to species loss and emerging threats like diseases. 25 years of peer-reviewed articles highlight that improved connectivity conservation is vital for species' movement and adaptation in response to climate change. Wildlife corridors can increase movement between habitat patches by approximately 50%, ensuring larger, cohesive landscapes for migration and dispersal.","Human activities isolate wildlife, leading to habitat loss and fragmentation. Wildlife corridors are needed to enhance connectivity, biodiversity, and climate resilience (Ament et al).",,https://www.researchgate.net/publication/301202401_Wildlife_Connectivity_Fundamentals_for_Conservation_Action,Nature Conservation,Wildlife Connectivity,Land Corridors,,
Andre et al.,Globally representative evidence on the actual and perceived support for climate action,"Andre, Pedro","Falk, Armin",University of Bonn (DE),2024,Nature Climate Change,"​A survey of nearly 130,000 individuals across 125 countries reveals robust global support for climate action. Key findings include 69% willing to contribute 1% of income, 86% endorsing pro-climate norms, and 89% demanding political action. Countries vulnerable to climate change show a higher willingness to contribute. However, a state of pluralistic ignorance persists, with individuals underestimating others' willingness to act, complicating climate initiatives. This highlights the critical need to raise awareness of global support to foster a unified response to climate change.","A global survey of 130k people from 125 countries shows strong support for climate action, especially in vulnerable regions, but ignorance hampers initiatives (Andre et al).",,https://www.nature.com/articles/s41558-024-01925-3#Abs1,Climate Change,,,,
A. McGill,The Shrinking of the American Lawn,"McGill, Andrew",,The Atlantic,2016,The Atlantic,"The average new American home now measures 2,500 square feet, a significant 50% increase since the 1970s. ​Despite the larger home sizes, lot sizes have decreased by 13%, leading to a substantial 26% reduction in yard space, averaging just 0.14 acres. This trend persists even in regions with cheap land, like the South and Great Plains, suggesting a shift in consumer preference for larger homes at the expense of yard space. Economic factors drive this change, with developers balancing the cost of larger homes by reducing lawn acreage, a notable shift in American residential patterns.","The average new American home measures 2,500 sq ft, increasing by 50% since the 1970s, while yard space has shrunk by 26% due to smaller lots and economic factors (A. McGill).",,https://www.theatlantic.com/business/archive/2016/07/lawns-census-bigger-homes-smaller-lots/489590/,Nature Conservation,Land Conservation,Urban Biodiversity,,
Anjos et al.,The effects of ants on pest control: a meta-analysis,"Anjos, Diego V. ","Tena, Alejandra","Instituto de Biologia, Universidade Federal de Uberlândia",2022,Proceedings of the Royal Society B,"Conventional agriculture's environmental impact has spurred interest in sustainable methods, with ants playing a crucial role in biological pest control. ​An analysis from 52 studies on 17 crops shows that ants reduce non-honeydew-producing pests, decrease plant damage, and increase crop yield. In addition, ants shrink the abundance of natural enemies and boost honeydew-producing pest abundance. The pest control and protection by ants are enhanced in shaded crops and this effect increases in time, which provides a good tool for sustainable farming practices.","Ants are crucial for pest control. ​An analysis from 52 studies on 17 crops shows that ants reduce pests, decrease plant damage, and increase crop yield (Anjos et al). ",,https://doi.org/10.1098/rspb.2022.1316,General,Regenerative Croplands,Sustainable Fertilizer,,
Anthony et al.,Forest tree growth is linked to mycorrhizal fungal composition and function across Europe,"Anthony, Mark A. ","Crowther, Thomas W.",ETH Zürich,2022,The ISME Journal,"Most trees form symbiotic relationships with ectomycorrhizal fungi (EMF), which influence access to growth-limiting soil resources. Mesocosm experiments show that EMF species differentially affect plant development. This study combined molecular EMF surveys with forest inventory data from 15 European countries. ​These findings suggest that EMF composition is a strong bio-indicator of underlying drivers of tree growth and/or that variation of forest EMF communities causes differences in tree growth. Fast tree growth was associated with EMF communities favoring inorganic nitrogen acquisition and contact exploration types.","Ectomycorrhizal fungi (EMF) symbiosis affects tree growth and soil resource access; forest fungi composition can influence tree growth, favoring inorganic nitrogen aquisition (Anthony et al).",,https://www.nature.com/articles/s41396-021-01159-7,Nature Conservation,Land Conservation,,,
Uludere-Aragon et al.,Sustainable land use and viability of biojet fuels,"Uludere-Aragon, Nazli Z. ","Parker, Nathan C.",Environmental Defense Fund,2022,Nature Sustainability,"Decarbonizing aviation with low-carbon liquid fuels is crucial as large aircraft electrification is currently unviable. This study integrates land-use assessment, hydroclimate and ecosystem modeling, and economic optimization to evaluate biojet-fuel potential from cellulosic feedstocks in the U.S. ​Planting 23.2 million hectares of marginal lands with miscanthus could meet the projected 2040 jet-fuel demand at an average $4.1 per gallon. This land conversion in the Midwest delivers productive biomass, regional cooling without soil moisture loss, and the lowest greenhouse gas emissions at a $50 per tCO2e carbon price. Integrated approaches are essential for a realistic sustainability assessment of bio-based alternative feedstocks.",Low-carbon liquid fuels can decarbonize aviation. Planting 23.2M hectares of miscanthus on marginal lands meets 2040 jet-fuel demand at $4.10/gallon with low GHG emissions (Aragon et al).,,https://www.nature.com/articles/s41893-022-00990-w,Energy Transition,Renewable Transport,Sustainable Biofuel,,
Arneth et al.,"Climate Change and Land, Chapter 1: Framing and Context","Arneth, Almut","Deton, Fatima",IPCC,2019,IPCC,"The use of land provides the basis for human life and well-being through supplying food, freshwater, and ecosystem services. However, the current use and influence by humans of land is unprecedented, and climate change along with overexploitation of resources has serious consequences for human society as well as biodiversity and ecosystem health. There is urgent need for a combination of rapid GHG emission reductions and land-based strategies to stop overexploitation to mitigate climate change. ","Land use is essential for food, water, and ecosystems is being overexploited. Combined GHG cuts and land strategies are urgently needed for climate change mitigation (Arneth et al).
",,https://www.ipcc.ch/site/assets/uploads/2019/08/2b.-Chapter-1_FINAL.pdf,Climate Change,Climate Impacts,,,
Ashgari et al.,Quantitative analysis of the nutritional components in leaves and seeds of the Persian Moringa peregrina..,"Asghari, Gholamreza ","Palizban, Abbasali",Isfahan Uiniversity of Medical Sciences,2015,Pharmacognosy Research,"The study of Persian Moringa peregrina investigated its nutritional content in leaves and seeds from arid regions of Iran. ​Using atomic adsorption and flame emission spectrophotometer to analyze the leaves for nutrients, it was found that M. peregrina contains substantial amounts of Vitamin A (7-25 mg/100 g), Vitamin C (14-83 mg/100 g), Calcium (765-1165 mg/100 g), and Potassium (572-900 mg/100 g).This study revealed that daily use of these leaves and seeds can provide the recommended dietary allowance for these nutrients. ","A study of Persian Moringa peregrina in Iran's arid regions found its leaves and seeds are rich in vitamins A, C, calcium, and potassium, meeting recommended daily dietary needs (Asghari et al).",,https://www.phcogres.com/article/2015/7/3/1041030974-8490157968,Regenerative Agriculture,Regenerative Croplands,Perennial/Superfoods,,
Asner et al.,Airborne laser-guided imaging spectroscopy to map forest trait diversity and guide conservation,"Asner, G. P.","Martin, R. E.",Carnegie Institution for Science (Stanford),2017,Science,"Functional biogeography addresses the gap between field biodiversity data and satellite Earth system studies that support conservation efforts to protect more species and their contributions to ecosystem functioning. Airborne laser-guided imaging spectroscopy and environmental modeling was employed to create detailed forest canopy trait maps in the Peruvian Andes-to-Amazon biodiversity hotspot. Seven canopy traits displayed variation influenced by geology, topography, hydrology, and climate, revealing distinct beta functional diversity patterns. Notably, 53% of these functionally unique forests offer new conservation opportunities. Mapping functional diversity enhances our understanding of biosphere conservation amid land use and climate change.","Airborne spectroscopy reveals Andes-to-Amazon forest canopy traits, showing diversity patterns shaped by geology, topography, and hydrology with 53% in conservation areas (Asner et al).",,https://science.sciencemag.org/content/355/6323/385,Nature Conservation,Land Conservation,,,
Atwood et al.,Predators help protect carbon stocks in blue carbon ecosystems,"Atwood, Trisha B. ","Connolly, Rod M. ",University of Queensland; Utah State University,2015,FTU Digital Commons,"Unsustainable predator harvesting disrupts ecosystems, impacting carbon cycling and climate mitigation. Vegetated coastal habitats, rich in ""blue carbon,"" rely on intact predator populations for carbon capture, accumulation, and preservation. While predator effects on these ecosystems remain understudied, evidence highlights their critical role, calling for urgent research and improved policies to protect predators and mitigate climate change.","Predator loss disrupts carbon cycling in coastal habitats, risking blue carbon reserves. Urgent research, stronger policies are crucial for mitigation (Atwood et al).",,https://digitalcommons.fiu.edu/cgi/viewcontent.cgi?article=1408&context=fce_lter_journal_articles,Nature Conservation,,,,
Badgley et al.,Systematic over-crediting of forest offsets,"Badgley, Grayson","Freeman, Jeremy",CarbonPlan,2021,CarbonPlan,"Carbon offsets are widely utilized to mitigate greenhouse gas emissions. However, because offsets allow pollution to continue, they must reflect real climate benefits. California's forest carbon offsets program, valued at over $2B, was evaluated to verify its climate benefit claims. ​Findings reveal significant crediting errors, with 29% of offsets over-credited, equating to 30 MtCO2e or roughly $410M, indicating substantial inefficacy in real climate benefits.","Carbon offsets mitigate greenhouse gas emissions, but crediting errors in offsets allows pollution to continue in California where 29% over-credited climate benefits (Badgley et al).",,https://carbonplan.org/research/forest-offsets-explainer,Nature Conservation,Land Conservation,,,
Bahadur et al.,When too much isn't enough: Does current food production meet global nutritional needs?,"Bahadur, Krishna","Dias, Goretty M.","Department of Geography, Environment and Geomatics, University of Guelph",2018,PLOS One,"Sustainably feeding future generations is a critical challenge of the 21st century. Scholars suggest increased agricultural production, technological investments, dietary changes, and reduced food waste, but current global production overemphasizes grains, fats, and sugars, lacking sufficient fruits, vegetables, and protein. Correcting this imbalance could reclaim 51 Mha of arable land but would increase overall agricultural land by 407 Mha and raise greenhouse gas emissions. To achieve a nutritionally balanced diet while conserving land and reducing emissions, the focus must shift towards producing and consuming more fruits, vegetables, and plant-based proteins, supporting habitat protection and Sustainable Development Goals.","Feeding future generations is a challenge of the 21st century. Scholars suggest increased agricultural production, technological investments, dietary changes, and reduced food waste. (Bahadur et al).",,https://doi.org/10.1371/journal.pone.0205683,Regenerative Agriculture,Regenerative Croplands,Crop Optimization,,
Balch et al.,Human-started wildfires expand the fire niche across the United States,"Balch, Jennifer K. ","Bradley, Bethany A. ",Earth Lab (UC Boulder),2017,PNAS,"Economic and ecological wildfire costs in the U.S. have surged with human activity playing a critical role. Analyzing over 1.5M wildfire records (1992-2012), humans ignited 84% of fires, burning 44% of affected areas, and prolonged fire seasons threefold. Human-started fires were dominant (>80% of ignitions) in over 5.1M km², the vast majority of the U.S. whereas lightning-caused fires' were dominant in only 0.7M km² in sparsely populated areas. ","Analyzing over 1.5M wildfire records, human activity surges wildfire costs, igniting 84% of fires, burning 44% of affected areas, and prolonging fire seasons threefold (Balch et al).",,http://www.pnas.org/content/pnas/early/2017/02/21/1617394114.full.pdf,Climate Change,Climate Impacts,Wildfires,,
Baldi et al.,Opportunities drive the global distribution of protected areas,"Baldi, Germán","Texeira, Marcos",Instituto de Matemática Aplicada San Luis (Argentina),2017,PeerJ,"Global and regional distributions were analyzed to understand whether protection areas target a balanced representation of biophysical environments, preferred conditions, or conservation opportunities. Using histograms, global protection was found to be mainly driven by isolation and low population density, with secondary tourism and border influences. ​Results indicate that protection at a global level is primarily driven by the opportunities provided by isolation and a low population density. Preferences play a secondary role, with a bias towards tourism attractiveness and proximity to international borders.","Protected areas globally are primarily driven by isolation and low population density, with tourism and border influences coming in second (Baldi et al).",,https://peerj.com/articles/2989/,Nature Conservation,Land Conservation,Protected Lands,,
Balmford et al.,Realizing the social value of impermanent carbon credits,"Balmford, Andrew","Keshav, Srinivasan",University of Cambridge,2023,Nature Climate Change,"Efforts to mitigate climate change by conserving natural habitats face challenges in long-term impact quantification. This study presents a flexible framework to estimate the net social benefit of impermanent nature-based interventions by: (1) defining impact permanence via additionality over time; (2) incorporating risk-averse estimation of future carbon gain reversals; and (3) employing post-credit monitoring to correct forecasting errors. This framework incentivizes the protection of credited carbon and allows for comparable assessments of diverse carbon projects, suggesting competitive pricing for nature-derived credits despite impermanence.",Efforts to mitigate climate change by conserving natural habitats face challenges in long-term impact quantification (Balmford et al).,,https://www.nature.com/articles/s41558-023-01815-0,Nature Conservation,,,,
Bamber et al.,Ice sheet contributions to future sea level rise from structured expert judgement,"Bamber, Jonathan L.","Oppenheimer, Michael",Technical University of Munich,2019,PNAS,"Despite advancements in modeling and observation, ice sheet models' predictive capabilities remain limited. ​Ice sheets are the largest uncertainty in sea-level rise (SLR) projections. A study reveals expert uncertainty, particularly due to dynamic ice effects. Under a +2°C scenario, median and 95th percentile SLR estimates are 26 cm and 81 cm by 2100 and 51 cm and 178 cm for a +5°C scenario. Including thermal expansion and glaciers, total SLR may exceed 2 m by 2100. SLR of 7.5 m is possible by 2200 under +5°C due to Antarctic ice instabilities. Process correlations and tail dependences increase estimates by 15%.","Predictive limitations in ice sheet models and dynamic ice effects lead to significant SLR uncertainty. By 2100, estimates range from 26-178 cm; by 2200, up to 7.5 m (Bamber et al).",,https://doi.org/10.1073/pnas.181720511,Climate Change,Climate Impacts,Sea Level Rise,,
Barry et al.,Pumas as ecosystem engineers: ungulate carcasses support beetle assemblages in the Greater Yellowstone Ecosystem,"Barry, Joshua M. ","Elbroch, L. Mark",Pace University,2018,Oecologia,"Predators abandoning their prey may be ecosystem engineers that create habitat for carrion-dependent invertebrates that utilize carcasses during critical life-history periods. Beetle assemblages at 18 puma-killed carcasses and control sites were researched to measure beetle utilization. ​The study found significant increases in beetle abundance, species richness, and diversity at carcasses, with a large effect lasting 8 weeks. The research underlines the important role apex predators play in shaping beetle communities by creating carrion ""habitats"" and suggests potential ecological consequences if these predators decline or disappear. ","Beetle abundance, species richness, and diversity rose at 18 puma-killed carcasses over 8 weeks, highlighting apex predators' critical ecological role (Barry et al).",,https://link.springer.com/article/10.1007/s00442-018-4315-z?_ga=2.168076453.568383898.1565204967-908268909.1565204967,Nature Conservation,Land Conservation,Conserved Lands,Land Habitats,
